{
  "stage": "stage-04",
  "status": "PASS",
  "orchestrator": "devteam@0.7.0",
  "track": "full",
  "timestamp": "2026-05-26T20:11:01.722Z",
  "blockers": [],
  "warnings": [],
  "workstreams": [
    {
      "workstream": "backend",
      "host": "codex",
      "status": "PASS"
    },
    {
      "workstream": "frontend",
      "host": "claude-code",
      "status": "PASS"
    },
    {
      "workstream": "platform",
      "host": "claude-code",
      "status": "PASS"
    },
    {
      "workstream": "qa",
      "host": "claude-code",
      "status": "PASS"
    }
  ]
}
